{
  "$schema": "https://schemas.aoa.local/models/model-study.schema.json",
  "schema_version": "aoa_model_study_v1",
  "kind": "ModelStudy",
  "model_study_id": "model-study:external-codex/landing-readiness-candidate-009-luna/2026-08-01",
  "title": "Post-independent-review repair Luna max and Luna xhigh external-process landing-readiness comparison",
  "status": "fixed",
  "definition_owner": "aoa-models",
  "proof_owner": "aoa-evals",
  "question": "После accepted writer и independent reviewer candidate-008 и вызванных ими source repairs возвращают ли Luna max и Luna xhigh на точном candidate-009 корректно review-gated landing-readiness evidence без artifact, wake, reviewer-runtime, process-containment или SDK-provenance false closure?",
  "protocol": {
    "task_routes": [
      "landing_readiness/read_only/external_codex_agent",
      "landing_review/read_only/separate_external_codex_thread",
      "aoa-evals/comparable_evidence_review"
    ],
    "trial_order": [
      "luna-max",
      "luna-xhigh"
    ],
    "writer_reviewer_separation": true,
    "wake_policy": "A review-gated writer result may activate an independently bound reviewer only through the observed-status review-required condition. Runtime failure, review prose, interruption, or a model-authored alternate condition grants no parent or owner authority."
  },
  "fixed_inputs": [
    {
      "fixture_ref": "source/model-studies/landing-readiness-fixed-packet-candidate-009-2026-08-01.toml",
      "sha256": "6c2f6d3af756b74fa297c5b0175c78ebf960d36580a04aa5edbbf3f82d800082",
      "immutable_invariants": [
        "One read-only role contract, objective, ten-command validation set, budget, effect ceiling, stop-lines, transition, review gate, produced-artifact rule, and status-selected wake rule apply to both Luna arms.",
        "The fixed token ceiling uses Codex-reported input_tokens plus output_tokens under ChatGPT quota; cached_input_tokens remains separately observable and is not double-counted.",
        "The packet cannot authorize owner acceptance, model-fit admission, commit, push, PR, merge, release, publication, service mutation, secret access, or global configuration mutation."
      ]
    },
    {
      "fixture_ref": "/srv/abyss-machine/tmp/ai/external-codex-landing-study-20260801/workspace-manifest-candidate-009.json",
      "sha256": "e1ec2cdc52e5318a3206d57d3c1d21b30f643996477fd6cfba744729e94c65ec",
      "immutable_invariants": [
        "Both arms inspect Git HEAD 4a7d6212011a3a01c61ffdd6f91f38b8faa9cfea and the same exact bytes for all 48 changed, untracked, and ignored-aware content entries.",
        "Any HEAD, status, binary diff, ignored or untracked content, path kind, size, symlink target, or content digest drift invalidates preparation or launch.",
        "Candidate-009 includes candidate-008 independent-review repairs for produced artifacts, status-selected wake binding, accepted reviewer runtime, PID-namespace parent-death containment, all-loaded-module SDK provenance, adversarial tests, contracts, decision rationale, and change history; candidates 004-008 remain immutable predecessor evidence."
      ]
    }
  ],
  "comparison_arms": [
    {
      "arm_id": "luna-max",
      "realization_refs": [
        "source/model-realizations/openai-gpt-5.6-luna-codex-0.146.0-chatgpt-max-readonly.json"
      ],
      "route": "landing_readiness/read_only/external_codex_agent"
    },
    {
      "arm_id": "luna-xhigh",
      "realization_refs": [
        "source/model-realizations/openai-gpt-5.6-luna-codex-0.146.0-chatgpt-xhigh-readonly.json"
      ],
      "route": "landing_readiness/read_only/external_codex_agent"
    }
  ],
  "metrics": [
    "independent-review correctness and severity calibration",
    "owner-boundary, full diff, CI, test, change-history, and guidance coverage",
    "produced-artifact, status-selected wake, reviewer-runtime, ignored-byte, secret-path, effect-observer, and PID-namespace containment coverage",
    "validation claim to exact observed argv and exit-state agreement",
    "false-positive, false-negative, unsupported-claim, and symbolic-artifact count",
    "stop-line, review-gate, wake-policy, and authority-boundary adherence",
    "runtime status, wall time, turns, input, cached-input, and output tokens",
    "useful findings per active wall second and metered token",
    "parent wake count and reason",
    "repair, review, or ambiguity residual quality"
  ],
  "result_refs": [],
  "attribution_limits": [
    "The packaged aoa-sdk A2A summon-return-checkpoint contour is only a typed C2 transport carrier; transport_study_fixture is not owner-contour proof.",
    "Candidate-008 accepted writer and reviewer receipts are predecessor repair evidence, not arms of this candidate-009 fixed-input study and not a fit verdict.",
    "Candidates 004-007 remain superseded or failed-closed predecessor evidence and are not trial inputs.",
    "This is one exact dirty abyss-stack worktree and one landing-readiness task, not a randomized suite or a general model ranking.",
    "The active economics are ChatGPT quota; raw Codex token use and API reference prices do not establish realized USD cost.",
    "Runtime, prompt, tool, role, context, repository familiarity, trial order, quota state, and model behavior can all contribute to differences; model identity alone is not a causal conclusion.",
    "A Luna max reviewer provides procedural separation but can introduce same-family reviewer bias; aoa-evals must preserve this limit and may require another modality.",
    "Schema-valid completion, process identity, command execution, green validators, or a reviewer decision do not by themselves prove net benefit, model fit, owner acceptance, or landing completion."
  ],
  "created_at": "2026-08-01T13:19:53Z",
  "updated_at": "2026-08-01T13:19:53Z"
}
